{
  "axis": {
    "quantity": "absolute_temperature",
    "unit": "K"
  },
  "cases": [
    {
      "model_id": "synthetic_linear_temperature",
      "model_snapshot": {
        "author_provenance": {
          "author": "Materials Boundaries contributors",
          "creation_method": "independently_authored_demonstration_polynomial",
          "derived_from_measurements": false,
          "is_empirical": false
        },
        "branches": [
          {
            "coefficients_text": [
              "10",
              "0.1",
              "0",
              "0",
              "0"
            ],
            "endpoints": "inclusive",
            "equation_range_K": [
              10,
              100
            ],
            "id": "synthetic_linear_10_100",
            "range_status": "artificial_demonstration_interval",
            "reported_fit_error": {
              "confidence_level": null,
              "is_confidence_interval": false,
              "is_measurement_uncertainty": false,
              "is_validated_maximum_error_bound": false,
              "statistic": null,
              "status": "not_applicable_synthetic_demo",
              "unit": null,
              "value": null
            },
            "source_data_range_K": null
          }
        ],
        "classification": "synthetic_demo",
        "coefficient_order": [
          "a",
          "b",
          "c",
          "d",
          "e"
        ],
        "coefficient_units": [
          "GPa",
          "GPa/K",
          "GPa/K^2",
          "GPa/K^3",
          "GPa/K^4"
        ],
        "curation_date": "2026-10-02",
        "descriptions": {
          "de": "Projekteigene SYNTHETISCHE Demonstration: lineares Polynom mit künstlichen Temperaturintervallen. Keine Darstellung realer Materialien, Messungen, empirischer Anpassungen, physikalischer Vorhersagen oder theoretischer Schranken.",
          "en": "Project-authored SYNTHETIC linear polynomial demonstration with artificial temperature intervals. No real material, measurements, empirical fit, physical prediction or theoretical bound is represented.",
          "ja": "プロジェクト独自の合成線形多項式デモ。温度区間は人為的に設定されており、実在材料、測定、経験的適合、物理的予測、理論的限界を表さない。",
          "zh": "项目原创的合成线性多项式演示，温度区间为人为设定。不代表真实材料、测量、经验拟合、物理预测或理论界。"
        },
        "equation_display": "E_GPa = a + b*T_K + c*T_K^2 + d*T_K^3 + e*T_K^4",
        "equation_family": "temperature_quartic_v1",
        "evaluation_support": "temperature_quartic",
        "id": "synthetic_linear_temperature",
        "input_unit": "K",
        "material": {
          "UNS": null,
          "identity_status": "synthetic_demo",
          "name": "SYNTHETIC linear demonstration",
          "temper": null,
          "temper_status": "not_applicable_synthetic_demo"
        },
        "name": "SYNTHETIC linear temperature demonstration",
        "output_unit": "GPa",
        "overlap_policy": "retain_all_matching_branches_without_selection_averaging_or_smoothing",
        "quantity": "youngs_modulus",
        "range_interpretation": "Artificial, inclusive demonstration intervals chosen by the project authors. Null source data ranges mean there are no observations; overlaps exercise branch retention only.",
        "reuse": {
          "caveats": [
            "Coefficients and intervals were authored for software demonstrations; no measurement collection or external correlation is represented.",
            "Artificial values are not usable as real-material evidence or design inputs.",
            "Arithmetic checks do not establish empirical validity."
          ],
          "recommended_attribution": "Materials Boundaries contributors, synthetic temperature demonstrations, 2026-10-02.",
          "status": "Original project-authored synthetic demonstration; see project LICENSE for reuse terms."
        },
        "scope_exclusions": [
          "All real-material property inference",
          "Empirical accuracy, experimental or statistical error claims",
          "Strength, safety factors, design allowables and physical bounds",
          "Extrapolation beyond artificial demonstration intervals"
        ],
        "source_ids": [
          "materials_boundaries_synthetic_temperature_demo"
        ],
        "source_locator": "Project-authored linear demonstration in materials_boundaries/data/temperature_models.json",
        "unknown_conditions": {
          "cold_work": {
            "status": "not_applicable_synthetic_demo",
            "value": null
          },
          "confidence_level": {
            "status": "not_applicable_synthetic_demo",
            "value": null
          },
          "fit_error_statistical_definition": {
            "status": "not_applicable_synthetic_demo",
            "value": null
          },
          "grain_size": {
            "status": "not_applicable_synthetic_demo",
            "value": null
          },
          "measurement_uncertainty": {
            "status": "not_applicable_synthetic_demo",
            "value": null
          },
          "porosity": {
            "status": "not_applicable_synthetic_demo",
            "value": null
          },
          "pressure": {
            "status": "not_applicable_synthetic_demo",
            "value": null
          },
          "product_form": {
            "status": "not_applicable_synthetic_demo",
            "value": null
          },
          "specimen_geometry": {
            "status": "not_applicable_synthetic_demo",
            "value": null
          },
          "strain_rate_or_frequency": {
            "status": "not_applicable_synthetic_demo",
            "value": null
          },
          "test_direction": {
            "status": "not_applicable_synthetic_demo",
            "value": null
          },
          "test_method": {
            "status": "not_applicable_synthetic_demo",
            "value": null
          },
          "texture": {
            "status": "not_applicable_synthetic_demo",
            "value": null
          }
        },
        "verification": {
          "empirical_validation": false,
          "independent_scientific_review": false,
          "synthetic_arithmetic_checked": true,
          "translation_review": "machine_assisted_not_scientifically_reviewed"
        },
        "version": "1.0.0"
      },
      "overlaps": [],
      "series": [
        {
          "branch_id": "synthetic_linear_10_100",
          "equation_range_K": [
            10,
            100
          ],
          "points": [
            {
              "status": "prediction",
              "temperature_K": 10,
              "value_GPa": 11.0
            },
            {
              "status": "prediction",
              "temperature_K": 10.9,
              "value_GPa": 11.09
            },
            {
              "status": "prediction",
              "temperature_K": 11.8,
              "value_GPa": 11.18
            },
            {
              "status": "prediction",
              "temperature_K": 12.7,
              "value_GPa": 11.27
            },
            {
              "status": "prediction",
              "temperature_K": 13.6,
              "value_GPa": 11.36
            },
            {
              "status": "prediction",
              "temperature_K": 14.5,
              "value_GPa": 11.45
            },
            {
              "status": "prediction",
              "temperature_K": 15.4,
              "value_GPa": 11.54
            },
            {
              "status": "prediction",
              "temperature_K": 16.3,
              "value_GPa": 11.63
            },
            {
              "status": "prediction",
              "temperature_K": 17.2,
              "value_GPa": 11.72
            },
            {
              "status": "prediction",
              "temperature_K": 18.1,
              "value_GPa": 11.81
            },
            {
              "status": "prediction",
              "temperature_K": 19.0,
              "value_GPa": 11.9
            },
            {
              "status": "prediction",
              "temperature_K": 19.9,
              "value_GPa": 11.99
            },
            {
              "status": "prediction",
              "temperature_K": 20.8,
              "value_GPa": 12.08
            },
            {
              "status": "prediction",
              "temperature_K": 21.7,
              "value_GPa": 12.17
            },
            {
              "status": "prediction",
              "temperature_K": 22.6,
              "value_GPa": 12.26
            },
            {
              "status": "prediction",
              "temperature_K": 23.5,
              "value_GPa": 12.35
            },
            {
              "status": "prediction",
              "temperature_K": 24.4,
              "value_GPa": 12.44
            },
            {
              "status": "prediction",
              "temperature_K": 25.3,
              "value_GPa": 12.53
            },
            {
              "status": "prediction",
              "temperature_K": 26.2,
              "value_GPa": 12.62
            },
            {
              "status": "prediction",
              "temperature_K": 27.1,
              "value_GPa": 12.71
            },
            {
              "status": "prediction",
              "temperature_K": 28.0,
              "value_GPa": 12.8
            },
            {
              "status": "prediction",
              "temperature_K": 28.9,
              "value_GPa": 12.89
            },
            {
              "status": "prediction",
              "temperature_K": 29.8,
              "value_GPa": 12.98
            },
            {
              "status": "prediction",
              "temperature_K": 30.7,
              "value_GPa": 13.07
            },
            {
              "status": "prediction",
              "temperature_K": 31.6,
              "value_GPa": 13.16
            },
            {
              "status": "prediction",